Naslov,Score,Komentarji,Vir
ISIS orders all women and girls in Mosul to undergo Female Genital Mutilation,343,1123,theguardian.com
Justin Bieber Arrested for Drag Racing / DUI (Miami),735,3669,nbcmiami.com
Kanye West halts Sydney concert after two fans refuse to stand up - doesn't realise one is in a wheelchair and the other is disabled,1294,2782,independent.co.uk
Actress Ellen Page has come out as a lesbian,1090,2335,hrc.org
"Shots fired into church in Memphis, TN",0,37,cbs46.com
"E-cigarettes contain 10 times the level of cancer-causing agents as regular tobacco, Japanese scientists said Thursday.",135,263,afp.com
Planned Parenthood Caught Illegally Selling Aborted Fetal Body Parts,0,397,worldmag.com
"Steve Jobs Is Dead, Reports AP",11,74,sfist.com
"CNN Reporter states ""Reddit not a reliable news source""",1044,1558,self.news
"Girl, 12, beats Einstein and Stephen Hawking to get top score in IQ test",6,73,news.com.au
"Bruce Willis considering lawsuit against Apple over iTunes store music transferability. He wants his daughters to be able to inherit his iTunes music upon his death, but Apple's terms prohibit any transfer of ownership.",18,29,macrumors.com
Active shooter at DC Navy Yard,0,57,wjla.com
"A National Emergency has just been 
declared by President Obama",79,151,whitehouse.gov
Patriots win Super Bowl XLIX,0,132,nfl.com
Teenager Gets New iPhone For Christmas… Along With 18-Point Contract From Mom,7,58,cultofmac.com
Ryan Dunn from Jackass possibly killed in this accident. Not yet confirmed,42,79,philadelphia.cbslocal.com
Obama considers ending NSA surveillance programs.,1252,1060,rt.com
BREAKING: George Zimmerman has been taken into custody after an altercation involving a gun.,1258,4416,clickorlando.com
"Mathematicians want to ""severe ties with the NSA"", and make working for the NSA and its ilk ""socially unacceptable""",1212,613,golem.ph.utexas.edu
"Study confirms that the US is No. 1 in mass shootings, blames 'gun culture'",0,210,stuff.co.nz
"Pope Francis tells family that drove 13,000 miles to see him: ‘You are crazy’",2075,857,washingtonpost.com
Tamerlan Tsarnaev Linked to Unsolved Murders in 2011,53,116,bostonglobe.com
Jews ordered to register in east Ukraine,13,43,usatoday.com
'Dozens' of children's bodies found in Texas mass grave,0,27,khou.com
Shooting on the OU campus,163,244,twitter.com
Law enforcement sources tell CBS News the Oregon shooter was 26-year old Chris Harper Mercer,0,260,cbsnews.com
I am on the old guys side.,58,331,cnn.com
Flight turns unforgettable when passengers learn of fallen soldier.,1118,1530,travel.yahoo.com
"Movie theater sends guy in full body armor and a fake M4 into Iron Man 3 opening as a ""publicity stunt"".",852,752,abc17news.com
Gunman with Assault Rifle and Body Armor at MIT.,63,227,emergency.mit.net
Too little too late: Boy that accused Michael Jackson of molestation admits it was a LIE...Dad put him up to it.,52,49,momento24.com
"You might have missed it, but the US just agreed that Edward Snowden was right",2652,1204,i100.independent.co.uk
Pirates have seized a ship carrying nuclear cargo. Shipping firm trying to hush it up. It seems no major news channels are aware.,0,12,indymedia.org.uk
"New report: $15 minimum wage could cost New York 200,000 jobs",7,158,syracuse.com
29 year old apparently found an image of MH370,64,47,thehindu.com
Caught on tape: Pizza Hut cooks smoking weed on New Years Day while preparing pizzas,3,108,abc15.com
STOP POSTING THE FUCKING MIAMI CANNIBAL/ZOMBIE ATTACK/FACE EATING HOBO/BATH SALTS STORY FOR CHRISTS SAKE!!!,38,28,self.news
"Neil Heslin, Father Of Newtown Victim, Heckled By Pro-Gun Activists ",29,151,huffingtonpost.com
Michael Jackson has Passed Away at the age of 50,0,21,tmz.com
"Religious people are less intelligent than atheists, study finds.",0,73,ca.news.yahoo.com
Dentist who killed Cecil the lion takes potshots at social media,99,251,marketwatch.com
Psych meds linked to 90% of school shootings,0,28,mobile.wnd.com
Federal judge nominated by George W. Bush sent hundreds of bigoted and racist emails,379,205,sfgate.com
"Motorcyclist who filmed, uploaded police chase video sentenced to four years in prison",242,122,arstechnica.com
"Seattle sees fallout from $15 minimum wage - some workers are asking their bosses for fewer hours as their wages rise – in a bid to keep overall income down so they don’t lose public subsidies for things like food, child care and rent",1,122,myfoxchicago.com
Second video shows Planned Parenthood doc haggling over price of fetal body parts | Fox News,0,61,foxnews.com
"Woman Uses Rainwater and Solar Power for Resources, Judge Declares Living Off Grid Illegal",565,438,naturalsociety.com
"Obesity Wipes Out USA Military Service. 70% Can't Serve, Becoming National Security Threat. Enlisted Obesity Up 61%.",1874,1509,baltimore.cbslocal.com
In case anyone cares: The Air-strikes have killed more Civilians in &lt;48hours than all the hullabuloo before US et. al. bombed Libya ,0,22,youtube.com
Man with gun at YALE university. CONFIRMED,9,53,nbcconnecticut.com
Man arrested after ejaculating during TSA pat-down,12,25,deadseriousnews.com
Broncos win Super Bowl 50,87,211,espn.go.com
Germany: man stabbed in head and back for shouting “merry Christmas” in Muslim dominated area,94,159,10news.dk
"So a mob destroys a hot dog vendor's stand, calls him a ""nigger,"" it's on video, victim tells his story, and it's not on the major networks? ",0,11,breitbart.com
Aaaaand a flight from Dulles to Dubai has been diverted to Iceland. Unclear why. Flight EK232 is a 777.,0,13,emirates.com
France teacher stabbed in class by man citing Islamic State,36,41,bbc.com
The fiddling with temperature data is the biggest science scandal ever,0,52,msn.com
"Bruce Jenner: ""I'm a Woman""",128,847,abcnews.go.com
"Iggy Azalea Quits Social Media After Body Bullying, Her Team Takes Over",0,63,abcnews.go.com
Tennessee school won’t allow gay teen to bring another boy to homecoming dance for ‘logistical reasons’,33,118,memphisflyer.com
Harvard Study Confirms Fluoride Reduces Children's IQ,0,71,articles.mercola.com
"Hours before San Bernardino shooting, doctors urged Congress to lift funding ban on gun violence research",9,68,washingtonpost.com
Tim Tebow cut by New England Patriots,157,134,nfl.com
Breaking news: Protesters have won! Mubarak stepping down!!!!,12,22,content.usatoday.com
Michael Brown's Mom Laid Flowers Where He Was Shot—and Police Crushed Them,5,35,motherjones.com
Scientists discover mushroom that makes women orgasm just by smelling it,0,25,foxbaltimore.com
"All amputees being treated in Ohio Veterans Affairs (VA) hospitals will be forced to share prosthetics after Governor John Kasich formally denied a $5,000,000 grant from the federal government late last week. ",10,13,delawareohionews.com
BREAKING: Dzhokhar Tsarnaev awake and responding to questioning,115,182,abcnews.go.com
"""Mother whose two boys were swept out of her arms in superstorm was left screaming on street for 12 hours by neighbors who refused to help her.""",0,29,dailymail.co.uk
Plus-size model graces cover of Sports Illustrated Swimsuit for the first time,0,95,wftv.com
Non-Muslim high school girls wear hijab to promote acceptance of Islamic beliefs,0,148,foxnews.com
Bruce Jenner comes out as transgender in the Diane Sawyer interview,0,42,time.com
"Architects, Engineers Say They Have Proof 9/11 Was A 'Lie' — New York - The group Architects and Engineers for 9/11 Truth say they have important evidence that proves the official story of the September 11, 2001 terrorist attacks was ""a lie” and “a fraud.”",0,25,digitaljournal.com
"Brilliantly London response to stabbing. ""You ain't no Muslim bruv.""",0,54,theguardian.com
Christopher Lee dies at the age of 93,3355,734,theguardian.com
U.S. falls to 28th on global gender equality list,0,9,usatoday.com
'Duck Dynasty’ Star Phil Robertson Fired Following Anti-Gay Remark,991,3369,tv.yahoo.com
White smoke!! New Pope Selected,28,110,suntimes.com
Reddit Won’t Run Any Display Ads for Marijuana Legalization,332,121,fdlaction.firedoglake.com
US Debt is actually six times worse than previously reported,67,69,rt.com
Al Sharpton Calls For Emergency Meeting To Address 'Appalling' All-White Oscar Nominees,0,106,finance.yahoo.com
Black Panthers Send Warning To Police: “We Will Start Creeping Up On You In the Darkness”,0,55,universalfreepress.com
[META] /r/news hits 7 Million subscribers,12,0,redditmetrics.com
"Race-based hate crimes spike in D.C.; whites most common victims, but underreporting feared",1377,1259,washingtontimes.com
Statistics show White Supremacy a bigger Threat to U.S. than Radical Muslims,33,111,news.yahoo.com
Did Elementary School Shooter Adam Lanza post his plans on the website 4chan?,0,16,politicolonel.com
Comic-Con: Women tired of groping geeks and credibility checks,0,44,bbc.com
'Star Wars: The Clone Wars' blasts onto Netflix in March with 13 Unreleased episodes from a Sixth Season,0,6,usatoday.com
Wiz Khalifa arrested for riding hoverboard at LAX Airport.,0,20,news.com.au
"""Programming cheerleaders"" hired in China to motivate male developers",23,228,jaxenter.com
Guns now kill more than cars for under 25's,0,36,economist.com
Super Bowl 2016: Broncos take down the Panthers 24-10.,0,11,us.cnn.com
Cowboys fans did the wave while a Redskins player was motionless on the field,18,71,washingtonpost.com
"ISIS Cuts Off 4 Kids Hands, One for Stealing Toy; Executes Starving Child for Stealing Food",77,130,christianpost.com
"Don't freak out, but scientists think octopuses 'might be aliens' after DNA study",33,110,irishexaminer.com
Reddit bans subreddit for finding the Navy Yard shooters,1134,716,washingtonpost.com
Owner of boat where Boston Bomber was hiding is heartbroken that his cherished boat is filled with bullet holes,13,30,dailymail.co.uk
"Nasa announcement: 'Amazing' Pluto discovery to be revealed, senior scientist says",65,97,independent.co.uk
"Restaurant posts 'No Guns Allowed' sign, gets robbed at gunpoint - An NC Gun Blog",50,413,ncgunblog.com
Seattle sees fallout from $15 minimum wage,0,72,foxnews.com
"ObamaCare architect says lack of transparency helped law pass, cites 'stupidity of the American voter'",0,43,foxnews.com
Secret Recording of NYPD Stop-and-Frisk: 'I'm Gonna Break Your Fuckin' Arm',0,5,gawker.com
Guy Who Gets Paid to Say Obamacare Doesn’t Work Can’t Find a Single True Fact to Support His Case,0,58,nymag.com
"FBI agent shoots, kills dog being walked by grandmother, 4-year-old grandson in Glen Burnie park",0,60,wjla.com
"Senate Bill S510 makes it illegal to grow, share, trade or sell homegrown food. This...makes Hitler seem sane. People are already being arrested for buying and selling raw milk. Do I still have life, liberty, and the pursuit of happiness in a world where I cannot grow my own food? ",189,159,republicdefiance.com
Justin Bieber abuses Perth girl.,0,25,novafm.com.au
Years of NRA tax filings are loaded with apparent falsehoods.,0,18,nypost.com
"More Police Are Killed in States With More Guns, Study Finds",5,68,nbcnews.com
"Dr. Phil: We've Created a Generation of Entitled, Narcissistic People",1,59,insider.foxnews.com
"After Giving 'Space To Destroy,' Baltimore Mayor Wants Americans To Save Her Skin In Big Way",1,23,westernjournalism.com
The cost of ‘quality of life’ policing: Thousands of young black men coerced to plead guilty to crimes they didn’t commit,0,53,washingtonpost.com
A Retired 9/11 First Responder Just Won $5 Million in the New York Lottery,3001,781,time.com
NY man gets 15 years in prison for filming boss set fire to homeless victim,1886,295,arstechnica.com
White House admits ObamaCare lie,6,110,nypost.com
Weapons of Mass Destruction were found in Iraq,0,60,foxnews.com
Scans prove there's no such thing as a 'male' or 'female' brain,0,52,newscientist.com
'Subway guy' Jared Fogle's home raided in child porn investigation,2031,1131,syracuse.com
School shooting at Indiana State University,298,160,indstate.edu
"Freddie Gray was intentionally trying to injure himself, witness says",5,117,washingtontimes.com
"Infant among 3 fatally shot in south Kansas City home. ""Idiots who have guns are going to use those guns for bad things. And until we come to grips with that and start taking the guns out of the hands of people who shouldn’t have them, we’re going to continue to have this. It’s just that simple.""",0,198,kctv5.com
"ISIS BEING OBLITERATED: Russian Warplanes Hit 1,093 Terrorist Targets in Syria Over Past 6 Days",42,65,jewsnews.co.il
"Leslie Nielsen has passed away after complications with phenomia according to his nephew Doug Nielse
",16,18,cjob.com
"7-year-old Emma Watson Nowling dead, mother in serious condition after Taylor, Michigan Sportsplex shooting. The man then turned the handgun on himself. ""It was a legal weapon"" He thought someone was out to get him""",0,58,mlive.com
AT&amp;T CEO Randall Stephenson found dead outside his home in Dallas Texas.,0,16,ireport.com
"Fearing for her children's safety, an Ohio single-mother has been jailed for sending her children to a suburban school district, rather than the city's collapsing school district.  The school district spent more than $6,000 to hire private detectives to bust her",132,156,wsws.org
(Breaking)Plot to bomb NYSE Stock Exchange allegedly thwarted by NSA surveillance. (Story Developing),26,155,cnbc.com
"USA Defeats Ghana in World Cup, 2-1.",2262,2624,q.usatoday.com
WikiLeaks head Julian Assange wanted in Sweden for rape,0,18,heraldsun.com.au
"Obama, Bush, Bloomberg to Bar 9/11 First Responders From Ground Zero On the 10th Anniversary",9,13,911blogger.com
"Texas Girl Was Taken Away From Parents Because They Smoked Pot, Only To Be Killed in Foster Care",2944,2637,blogs.houstonpress.com
University Report: A Room Full of White People Is a Microaggression,0,54,nationalreview.com
MIT Researcher: Glyphosate Herbicide will Cause Half of All Children to Have Autism by 2025,0,24,healthimpactnews.com
"Top Google Engineers: Renewable energy 'simply won't work'. Windmills, solar, tidal - all a 'false hope', say Stanford PhDs",141,344,theregister.co.uk
Barack Obama Becomes First Black President,29,19,projectwebdesign.com
Radio host sues Taylor Swift for accusing him of touching her bottom,175,124,theguardian.com
Florida running back poops his pants after touchdown,1,22,national.suntimes.com
"Marijuana kills cancer cells, confirms US government",2389,652,metro.co.uk
Did the US Use a Neutron Bomb in the Battle of Baghdad?,0,17,workers.org
Docs resisting ObamaCare,9,88,nypost.com
Man gets arrested for paying with $2 bills,11,26,articles.baltimoresun.com
"Several Ukrainian protestors have been abducted from the hospital, dragged out into the forest, stripped, and executed.",113,13,news.yahoo.com
"Hillary Clinton exploded on Secret Service for refusing to carry bags, says former agent",7,31,washingtontimes.com
A Texas hunting club is auctioning a permit to hunt and kill an endangered black rhino,1492,1173,abcnews.go.com
Neighbor Didn't Report Suspicious Activity of San Bernardino Killers For Fear of Being Called Racist,50,186,nation.foxnews.com
Nearly 90 Percent of Germans Do Not Believe Official 9/11 Fairy Tale,0,29,activistpost.com
Pro-Life Attorney: ‘We Need a Nuremberg for Abortion Doctors’,4,114,thedailybeast.com
Redditors Stand Up to Gawker to Protect Child Pornography via Yahoo News.,0,30,news.yahoo.com
The Sickening Child Porn Crisis Infecting U.S. Government Agencies,196,134,thedailybeast.com
There have been 334 days and 351 mass shootings so far this year,11,117,washingtonpost.com
"The morning before the Charlie Hebdo attacks, the Muslim community in Michigan gave $100,000 to the city of Detroit to help pay for the water bills of those in need.",2373,820,detroitnews.com
Virgin Plane Heading To Bali Hijacked,11,17,news.sky.com
"Off duty police officer kills just-married firefighter during fight, is cleared of all charges.",100,458,cnn.com
Obama receives standing ovation from less than 25% of West Point cadets: report,53,276,washingtontimes.com
Reporter Kicked Out of 9/11 Museum for Asking a Question Without Permission,1830,1948,nymag.com
Study: Allowing blood donations from gay men could help save over a million lives in U.S.,539,391,philly.com
New NASA Data Blow Gaping Hold In Global Warming Alarmism,24,165,news.yahoo.com
Ahmed Mohamed demands $15m compensation and written apology for homemade clock arrest,3711,10919,independent.co.uk
Oregon Rancher ‘Heroes’ Accused of Child Abuse,60,95,thedailybeast.com
Chimpanzee sues owner who held it captive. And makes history as first non-human primate to sue it's captor.,17,30,globalanimal.org
Women are more likely to be verbally and physically aggressive towards their partners than men suggests a new study presented as part of a symposium on intimate partner violence (IPV).,2252,4336,news-medical.net
Chris Rock and wife file for divorce after 19 years,42,63,news.yahoo.com
Shia LaBeouf: I was raped during performance art project,7,49,theguardian.com
Obama reminds McCain how foreign policy works,1,11,msnbc.com
"Dear Mr. Obama. Today you still have my vote. Permanently. I  care what you say between now and 2012, but realize you have been fighting to undo 8 long years of terrible leadership. I believe in you and see past what was a difficult political decision. That is all.",14,27,self.news
"Ahmed Mohamed family wants $15 million from Irving, Irving ISD - Story",2,27,fox4news.com
Pot problems in Colorado schools increase with legalization,4,15,denverpost.com
"Since 9/11, more in America have been killed by non-Muslim extremists than radical Muslims, according to new review",3230,2525,nytimes.com
Wal-Mart has a lower acceptance rate than Harvard,4,18,washingtonpost.com
Snowden lands safely in Venezuela,0,16,prlog.org
More videos to be released of Planned Parenthood alleged abortion practices selling body parts,1,76,cbsnews.com
"Man Saw Fellow Fan’s Pregnant Wife Texting Another Man at Lion's game, Does Something About It",5,20,madworldnews.com
Not even Arizona can stop progress. Gay marriage ban may fall next Friday.,0,7,azcapitoltimes.com
Why does America lose its head over 'terror' but ignore its daily gun deaths?,0,10,guardian.co.uk
9 foot shark eaten whole. Scientist are baffled by what could have devoured the alpha predator.,6,34,eliteenvy.com
Mystery woman pictured walking TOPLESS through streets of New York - nsfw,16,29,dailymail.co.uk
Apple's actions KILL several at iPhone factory in China - 2000 employees DESTROY the factory in a violent strike,0,16,sanjose.bizjournals.com
"Son of ""Hunger Games"" director has been confirmed as the Santa Barbara shooter.",3,15,wfsb.com
"Michelle Obama, queen of shade, shows Saudi Arabia just what she thinks of their society's ugly misogyny",0,35,mic.com
Tom Cruise: My work as an actor is as hard as fighting in Afghanistan,18,34,foxnews.com
Why you won't be seeing Coca-Cola ads for a while,33,33,ph.news.yahoo.com
"Alien life on Philae Comet, scientists say: Experts discover dark material is being constantly replenished and say: ""Something must be doing that at a fairly prolific rate.""",1610,371,news.sky.com
Rand Paul's only real problem with the Patriot Act - it records gun ownership,49,85,huffingtonpost.com
How college students think they are more special than EVER: Study reveals rocketing sense of entitlement on U.S. campuses,1,12,dailymail.co.uk
"There's been ""1,475 fatal shooting incidents since Newtown, including suicides and police-involved shooting deaths, Most were men killing women, husbands killing wives, boyfriends killing girlfriends, sons killing mothers.""",5,15,huffingtonpost.com
"'Someone's coming to get me': Terrified phone-hacking whistleblower feared for his life before he was found dead.
",246,87,dailymail.co.uk
A Reddit Mystery Solved: The Identity of 'Shitty_Watercolour',52,30,mashable.com
"""They destroyed Pearl Habor, we destroyed their dreams"" - Twitter row after US World Cup win",2,59,bbc.com
South Korea says it is withdrawing its remaining workers from a jointly-run industrial complex in North Korea.,2,4,bbc.co.uk
An arrest has been made in the Boston Bombing [CNN],0,8,edition.cnn.com
BREAKING NEWS: Israel Attacks Humanitarian Ship to Gaza in International Waters.,5,14,globalresearch.ca
ABC's ’08 Prediction: NYC Under Water From Climate Change By June 2015,8,44,mrctv.org
3 arrested with mortars after leaving Occupy Portland,14,35,kgw.com
possibly last known photo of paul walker getting into porsche.,6,14,mustangheaven.com
"The United States, with 88.8 guns per 100 people, had a gun-death rate of 10.2 per 100,000 people. A study by the American Journal of Medicine finds that the higher the per capita rate of gun ownership, the higher the rates of firearm-related deaths, the study found.",0,27,latimes.com
Whole town tries to flee socialist east Germany: A town in the former east German state of Thuringia wants to leave the socialist-ruled state and become part of wealthy Bavaria.,1,21,thelocal.de
Russell Brand urges Israel boycott,3,5,timesofisrael.com
Cologne attacks: American woman tells how Syrian refugees rescued her from New Year's Eve sexual assault,0,30,independent.co.uk
Sources tell CNN there is a suspect identified.,91,99,cnn.com
Toddler shoots and kills himself after getting gun,3,70,bigstory.ap.org
It's shit like this CNN ಠ_ಠ,100,100,i.imgur.com
Napa wine train controversy: 'I do think it was based on the color of our skin.' A group of African American women say they were humiliated by being ejected for ‘laughing while black’ – igniting debate on ‘white space’ and a possible lawsuit,0,51,theguardian.com
Unarmed black man killed by white Phoenix officer,0,37,usatoday.com
"Leonard Nimoy, Spock of ‘Star Trek,’ Dies at 83",4056,1396,nytimes.com
NY Daily News: San Berdoo victim was “hate-filled bigot” for liking “hateful Ann Coulter”,0,46,unz.com
Annnnnd it's not just the NSA. The Postal Service is logging all of your mail.,725,235,nytimes.com
Beyoncé references Black Panther Party at Super Bowl halftime show [Fox News],0,36,foxnews.com
Manhattan New York: Thugs rough-up a Jewish couple and drive off flying the Palestinian flag,1,40,nypost.com
Chelsea Manning spends sixth Christmas in prison with no end in sight,18,92,theguardian.com
Lafayette Shooter Had Tea Party Page,1,24,thedailybeast.com
"""I encourage everyone I know to never travel to Georgia, never buy anything made in Georgia, to never do business in Georgia. I will ask my publisher to pull my book from every Georgia bookstore. I ask all Americans to shun anything to do with the murderous state of Georgia."" – Michael Moore",109,146,blogs.indiewire.com
Rise in U.S. Terror Plots Tied to ‘Unprecedented’ Spike in Immigration,15,29,freebeacon.com
Police get called on suicidal teenager cutting himself: kill him,597,1574,washingtonpost.com
"Men who harass women online are quite literally losers, new study finds",8,17,washingtonpost.com
Fan Petitions for Weird Al Yankovic to Play the Super Bowl Halftime Show,2615,864,bleacherreport.com
"Dance teacher Ashley Blumenshine arrested for sex in car with student, 16 ",2,30,dailymail.co.uk
Who doesn't have to pay federal income taxes? 43% of Americans,52,162,money.cnn.com
Netflix is about to raise monthly fees,62,88,usatoday.com
Melissa Francis 'Silenced' by CNBC for Criticizing ObamaCare,0,20,insider.foxnews.com
Israel demolishes homes and tells Palestinian owners to pay the costs,6,59,middleeastmonitor.com
"10,000 Strong Peacefully Protest In Downtown Baltimore, Media Only Reports The Violence &amp; Arrest of Dozens",0,61,blackwestchester.com
"This is Lizard Squad, the nebulous hacker group now tied to the Sony hack",1,15,ca.news.yahoo.com
"CNN: the hard-hitting, exemplary journalism we need in today's complex world.",3,16,cnn.com
Gender Neutral Teenager Set Aflame While Napping On Oakland Bus,0,21,sfgate.com
Ohio State fan is horrified when she’s caught on camera during Sugar Bowl,6,44,ftw.usatoday.com
"Anti Israeli ""hackers"" website gets hacked by Israeli hackers.",20,6,opisrael.com
"The family of 24-year-old Jessica Ghawi, a victim in the 2012 movie theater shooting in Aurora, Colorado, is faced with more than $200,000 in legal costs after a federal judge ordered them to pay attorney’s fees for four ammunition dealers the family attempted to sue.",3307,4782,nbcbayarea.com
MLK assassinated by US government: King family civil trial 1999 decision. Why didn’t you know this?,8,21,911blogger.com
The San Francisco Giants have won the World Series,140,105,scores.espn.go.com
Anyone else support imposing a child tax on people who breed too much?,98,259,news.bbc.co.uk
"The white supremacist who influenced the Charleston shooter is found to have donated to the campaign funds of Rand Paul, Ted Cruz and Rick Santorum.",1315,985,nytimes.com
Michelle Obama refuses to wear head scarf while visiting Saudi Arabia,3,51,washingtonpost.com
"Gays are ""full of murder, envy, strife, hatred. They are insolent, arrogant, God-haters. They are heartless, they are faithless, they are senseless, they are ruthless. They invent ways of doing evil,"" says Duck Dynasty guy",17,100,businessinsider.com
"Something big is about to happen on the sun. According to measurements from NASA-supported observatories, the sun's vast magnetic field is about to flip",17,29,phys.org
University of Oklahoma - possible shots fired,30,53,self.news
