Naslov,Score,Komentarji,Vir"Counterpoint: Despite reports, SWAT Team helped Al-Jazeera reporters, did not take their equipment **says reporters ""thanked their officers""**",4,38,fox2now.com
Economic Strategist Offers $18.5 Billion for Detroit and Plan to Make it a Top 10 Global City,4,16,fentonreport.com
"Jews, once the oppressed, now Relish their Role as Oppressors in their quest to Exterminate Others in the Region",1,0,youtube.com
Nose grown on the forehead of a patient,0,10,bbc.co.uk
Decreasing solar activity will lead to 'mini ice age' by 2030,0,27,digitaljournal.com
Joan Rivers’ shocking rant: Palestinian civilians ‘deserve to be dead’,2,22,news.com.au
"The Powerball winning numbers are in. The numbers are: 8, 27, 34, 4, 19; The Powerball is: 10",3306,4227,nj.com
"Sharpton In Ferguson, Mo.: Release Of Michael Brown ‘Robbery’ Video ‘Insulting’.",0,29,newyork.cbslocal.com
Israeli military fatally shoots 13 year old Palestinian girl.,0,73,nytimes.com
Yale frat accused of holding 'white girls only party',3,26,kfvs12.com
10-year-old Ohio State fan worried heart surgery might make him a Michigan fan,0,6,kirotv.com
"The group Architects and Engineers for 9/11 Truth claims that 1,464 verified architectural and engineering professionals and 11,470 other supporters have signed a petition demanding of Congress ""a truly independent investigation"" into what caused the collapse of WTC Building 7 on 9/11.",1,15,911blogger.com
American Airlines Files For Bankruptcy,95,33,zerohedge.com
Obama to be added to Mount Rushmore.,4,28,dailykos.com
16 year old attempts to hijack plane in order to kill Miley Cyrus.,0,11,tvguide.com
Apple quiet on iCloud exploit after celebrity nudes leak,1719,1083,wired.co.uk
Remember those EMT's who were on a coffee break and didn't come to the aid of a woman having a heart attack? One of them was shot in the face last night.,12,31,1010wins.com
Aborted babies incinerated to heat UK hospitals,7,55,telegraph.co.uk
There have been 334 days and 351 mass shootings so far this year,0,40,washingtonpost.com
"BREAKING: FBI, DEA thwart terror plot in U.S. involving Iranian Government",60,171,news.blogs.cnn.com
"Religious kids are harsher and less generous than atheist ones, study says",2890,1435,oregonlive.com
Planned Parenthood “Hacking” Sure Looks Like An Orchestrated PR Stunt,0,54,thefederalist.com
Fukushima apocalypse: Years of ‘duct tape fixes’ could result in ‘millions of deaths’,279,119,rt.com
"16-Year-Old Florida Student Suspended: Wrestles Gun From Teen Aiming To Kill, Cypress Lake High School Student Gets 'Emergency Suspension",9,24,mstarz.com
"Breaking News (AP): Arrest imminent in marathon bombing, suspect to be brought to court",13,24,bigstory.ap.org
"Billionaires Dumping Stocks, Economist Knows Why ",3,7,moneynews.com
Child finds racist note in Wendy's kids meal,0,43,wfsb.com
The NRA’s brazen shell game with donations,0,19,yahoo.com
I am Adam Lanza's Mother,1,4,huffingtonpost.com
At Least 3.5 Million Americans Have Now Had Their Health Insurance Policies Canceled Thanks To Obamacare,69,171,businessinsider.com
Pressure grows to declare war against Christians a genocide,1,15,washingtontimes.com
"Store owner who sells Confederate flags, says flag does not represent racism, has family ties to KKK",0,66,independent.co.uk
"Stay at home mom's value to family calculated at $65,000/yr",0,47,deseretnews.com
Pravda: Putin Threatens to Release Satellite Evidence of 9/11,1,22,veteranstoday.com
"4 killed, 7 injured in head-on car crash in Northern California ",0,4,foxnews.com
Young Girl Plowed in Field,3,16,bbc.co.uk
We have 36 pound of plutonium left...in the world,16,53,wired.com
"Any douchebag dies and reddit gives them the front page.  But Jerry Reed, complete legend and badass, dies and nobody even mentions it?  Come ON!",17,23,answers.com
Massive Non-Citizen Voting Uncovered in Maryland,18,46,nation.foxnews.com
School embraces transgender student by voting her for Homecoming Queen,0,90,kctv5.com
"No woman 'totally straight', study says",0,30,bbc.com
"Insane Clown Posse Actually, Legitimately, Amazingly is Suing the FBI",6,9,gawker.com
The Truth about Navigators ⚡⚡ James O’Keefe reveals corruption at the heart of the president’s signature program.,5,32,nationalreview.com
"Shooting breaks out at Sikh temple in Wisconsin..Now a hostage situation
| Reuters",0,0,reuters.com
Man calls all Muslims terrorists during City Council meeting in Virgina,0,59,wusa9.com
"Transgender and non-transgender lesbian, gay and bisexual college students seem to be at the highest risk for eating disorders, according to a new study.",1,19,reuters.com
Video: White Cop Grabs Black Tween by Her Neck—And Slams Her Against His Squad Car,0,22,thedailybeast.com
"Pet Pit Bull Turns On Its Owner, Leaves Woman Seriously Injured",0,39,sanfrancisco.cbslocal.com
11-images-showing-the-extent-of-israels-palestinian-apartheid/,7,11,filmsforaction.org
Wife of man who filmed the recent fatal incident with NYPD now arrested.,2095,1175,democracynow.org
"Colorado will accept Syrian refugees, Gov. John Hickenlooper says",2,42,denverpost.com
"Founder of Westboro Baptist Church, Rev. Fred Phelps Sr. dies",2604,5371,kansasfirstnews.com
Investigators believe they have identified a suspect in the Boston Marathon bombings,189,94,cnn.com
Bill Gates Reveals What Makes Him Feel 'Pretty Stupid',36,35,abcnews.go.com
A LAW firm has been accused of old school sexism after a series of guidelines for female staff on how to dress and act were leaked online.,43,51,news.com.au
"Israelis were brutalized, castrated at Munich Olympics, widows reveal",7,17,jpost.com
Clinton paid women 72 cents for each dollar paid to men,0,21,freebeacon.com
"Humans emerged from male pig and female chimp, world's top geneticist says",0,18,articles.timesofindia.indiatimes.com
"Scumbag Anderson Cooper bashes Reddit, yet shares on Reddit",2,5,imgur.com
Howard Stern announces he will be a judge on America's Got Talent,0,10,blogs.wsj.com
"Pope Halts Car So He Can Bless Disabled Boy. A mother praises Francis' ""beautiful gesture"" after he makes an stop to kiss a 10-year-old boy with cerebral palsy.",1,33,news.sky.com
#IStandWithAhmed: President Obama Invites Ahmed Mohamed to White House to Show Him Clock Mistaken for Bomb,3,54,abcnews.go.com
Curiosity successfully landed on Mars!,7,4,self.news
Why that one Black Hawk crashed in the Bin Laden raid,4,27,foxnews.com
Highschooler given 8 years in prison for his Senior prank. (x-post from r/Indiana),108,150,theindychannel.com
"Since 1968, ""more Americans have died from gunfire than died in … all the wars of this country's history.""",11,40,politifact.com
Airline forces two first class passengers to change clothes before boarding - modern discrimination,2,9,today.com
Every 16-year-old in Sweden to receive copy of We Should All Be Feminists,3,124,theguardian.com
9-Year-Old Boy Donates Birthday Money to Buy Bulletproof K9 Vests,0,6,abcnews.go.com
"Atheism in America: Godlessness is the last big taboo in the US, where non-believers face discrimination and isolation",102,96,on.ft.com
Vatican: The gay sex is fine as long as they weren't using condoms.,33,53,guardian.co.uk
Morgan Freeman to marry his step-granddaughter.,0,13,shine.yahoo.com
OJ Simpson confesses murder to Oprah,4,16,dailymail.co.uk
"Why?  OMG, why?",12,41,nytimes.com
Judge turns loose thug who posted gun threat against cops,0,24,nypost.com
6 Charts That Show How Conservative Politics Are Destroying America,2,10,alternet.org
Dear Class of 2012: Good f*cking luck.,2,28,online.wsj.com
Sandy Hook shooting: Possible second gunman in custody ,7,18,washingtonpost.com
Man beaten into coma while on a walk in his St. Paul neighborhood by gang members. Yet to find this story on a major news outlet.,222,212,twincities.com
"When Hobby Lobby’s Critics Find Out How Much It Pays Employees, They Might Want To Get A Job There",0,71,ijreview.com
Archaeologists find possible site of Jesus’s trial in Jerusalem,5,39,washingtonpost.com
Donald Sterling banned from Bunny Ranch brothel following 'racist' rant,9,16,independent.co.uk
Mayor Rob Ford parks illegally,9,11,torontosun.com
"A gay Applebee's server was brutally beaten with a 2x4 by his coworker's husband, who was screaming homophobic slurs during the attack. The local police department refuses to classify this as a hate crime.",2027,1139,wisconsingazette.com
Truck overloaded with FIVE HUNDRED cats intercepted en route to restaurants in China ,14,15,mirror.co.uk
Obama: The only people with the right to object to immigration are Native Americans,13,46,independent.co.uk
"Campus stabber's manifesto included 'praise for Allah,' plan for beheading",1,35,foxnews.com
Judge Nap: Potential Fraud Case If Ahmed Mohamed's Clock Was 'Purposeful Hoax',1,46,insider.foxnews.com
Rapper Sean Price Passes Away This Morning,0,5,thesource.com
Texas bill threatens bathroom rights of transgendered people (x/post /Texas),0,38,kxan.com
Make no mistake: Michelle Obama just made a bold political statement in Saudi Arabia,0,11,washingtonpost.com
Vice President Biden uses anti Semitic slur in speech; ADL does mental gymnastics to excuse him for it.,0,26,cnn.com
Aborted babies incinerated to heat UK hospitals,0,14,telegraph.co.uk
"UK man's body floats in 3ft of water for 40 minutes while paramedics stand and watch, all because they aren't trained to go into water.",0,6,dailymail.co.uk
Blast hits midtown Manhattan,2,14,rt.com
"BREAKING - Bank of America DOWN! ATMS, Tellers, Online services all down",45,40,twitter.com
Dark Knight Rises Massacre Copy cat BUSTED before the show started in Ohio,18,40,nydailynews.com
Billionaire Mark Cuban Just Dropped the Biggest Truth Bomb About Student Loans...,12,35,youngcons.com
Trump: 'Is the Boston Killer Eligible for Obama Care to Bring Him Back to Health?',0,30,newsbusters.org
"US takes control of airport and blocks CARICOM's aid mission. ""The Caribbean Community's emergency aid mission to Haiti...failed to secure permission Friday to land at that devasted country's aiport, now under the control of the United States.""",3,14,trinidadexpress.com
"Ferguson police officer was badly beaten before shooting Michael Brown - Quincy, IL News",3,37,quincyjournal.com
Vet asked to leave Pizza Hut after manager thinks his USMC patches are gang symbols,9,25,rare.us
"A school district near where I live voted to allow teachers to carry firearms on campus. Well, during training class today ... yeah, you guessed it.",17,18,knue.com
Winning numbers are 4 8 19 27 34 10,145,128,powerball.com
Supreme Court legalizes gay marriage,5170,17086,washingtonpost.com
Bill Cosby Just Sent a Tweet to His Fans After Wednesday Arrest — and It Totally Backfired,1,33,news.yahoo.com
"Reports out of North Korea are that Kim Jong-Un fed his Uncle, and several of his closest aides to 120 starving dogs.",6,14,news.yahoo.com
"Times: ""The ADHD Fallacy: It’s Time To Stop Treating Childhood as a Disease""",3114,2214,time.com
"Neil deGrasse Tyson Defends Scientology: It's No Different Than Judaism, Christianity",80,236,hollywoodreporter.com
Black students denied entry into Apple store because 'they might steal something' | World | News | The Independent,0,74,independent.co.uk
WHAT? Juror in Apple-Samsung Suit May Have Owned Patent Used by Apple,816,234,androidpit.com
"File under ""no shit"": Massive Censorship Of Digg Uncovered.  And to be honest, liberal scum on Reddit can't wait to downmod any anti-Obama, anti-""free"" health care, or anti-Apple submission.  So Reddit = leftist scum.  Digg = right-wing conspiracy.  SOLVED!",0,6,blogs.alternet.org
"South Carolina Town Has No Syrian Refugees, Tells Them to GTFO Anyway",1,38,thedailybeast.com
"Scientists sound alarm over ""supercharged GMOs"" which could spread in the wild and cause environmental disaster.",2,28,independent.co.uk
"Policeman Shot in Ferguson, MO",0,13,breaking911.com
George Zimmerman arrested following disturbance at Fla. home AGAIN,0,15,cbsnews.com
"1.5 million barrels of liquid butane 
waiting to blow up in Louisiana (The 
story only gets worse from there...)",2,5,fromthetrenchesworldreport.com
These Are the Top 10 Jobs Most Likely to Attract Psychopaths (Should We Be Worried?),11,25,theblaze.com
Fewer mass shootings occur in states with more background checks,241,235,theguardian.com
"[CNN Money] Ellen Pao resignation petition reaches 150,000 signatures",4604,4511,money.cnn.com
"At a college walk-out in Massachusetts, White Ferguson protesters were told “to keep their hands down” because of their “white privilege.”",92,242,youngcons.com
Mark Zuckerberg reveals Facebook will add a Dislike Button,3757,2537,nbcnews.com
"In Austin, child who was taken from family because they smoked pot while she slept dies in foster care (crosspost from r/Austin)",1948,1769,kvue.com
Jimmy Carter has cancer,0,1,nytimes.com
"State Silences Bakers Who Refused to Make Cake for Lesbian Couple, Fines Them $135K",0,32,dailysignal.com
Congressional Leaders: Illegal Immigrant With Drug-Resistant Tuberculosis To Be Released Into U.S.,0,13,nation.foxnews.com
Daughter of lesbians speaks out against gay marriages,0,40,dailytelegraph.com.au
Grand Jury Indicts The Man Who Filmed Eric Garner's Death,1,18,msn.com
"Missouri cop was badly beaten before shooting Michael Brown, says source",313,992,foxnews.com
"Never mind, Samsung, GOOGLE will EAVESDROP as you browse on Chrome",121,73,theregister.co.uk
"Feds pay for guitar lessons, petting zoo trips for illegal immigrant children",0,27,washingtontimes.com
"Scientists discover that atheists might not exist, and that’s not a joke",0,40,science20.com
Retired army captain warns DHS acquisitions are bold threat of war against the american people,2,5,prisonplanet.com
Another Zombie Victim Found - Cops Tight-Lipped - Dead Naked In Ohio Field,0,5,thecount.com
The U.S. Invades and Occupies Pakistan,11,17,daily.pk
Senate Approves To Authorize Force in Syria,6,36,customwire.ap.org
CAUGHT ON VIDEO: Hate-crime vandalism against conservative student,6,74,thecollegefix.com
There's a New Dating Site for White People to Meet Each Other,3,41,yahoo.com
Obama says Syrian refugees are no bigger threat to U.S. than ‘tourists’,4,44,washingtontimes.com
Number of Americans Killed by Gun Violence Vs. Terrorism Shows Stark Contrast,0,40,nbcnews.com
Wal-Mart to Stop Selling Military-Style Guns After Demand Drops,0,11,bloomberg.com
Florida transgender woman beaten to death is 10th US trans murder in 2015,4,34,theguardian.com
Shock Video Catches Another Top Planned Parenthood Doctor Selling Body Parts of Aborted Babies,0,313,lifenews.com
Danish teen fought off her attacker - now she'll face fine. A 17-year-old girl who was physically and sexually attacked in Sønderborg will herself face charges for using pepper spray to fend off her assailant.,4138,10511,thelocal.dk
Gun Appreciation Day Celebrated With Accidental Shootings at Gun Shows in North Carolina and Ohio,1,13,gawker.com
BREAKING: US launches 50-100 Tomahawk cruise missiles to implement no fly zone over Libya,146,340,abcnews.go.com
Photos shows Citadel cadets dressed in Klan attire singing Christmas carols,2,51,abcnews4.com
Kid who donated his peggy bank to vandalized mosque gets a gift and thank you from Muslim community for his generosity,3,3,metro.co.uk
Obama administration appoints first openly transgender White House official,0,5,theskyherald.com
Why Freddie Gray Never Had a Chance: Lead Poisoning Is Killing Inner-City Baltimore,2,15,thedailybeast.com
CNN reports Officer Wilson did NOT have a broken eye socket after altercation with Michael Brown » The Right Scoop,1,31,therightscoop.com
All Red Lobster Restaurants to Close,0,20,theheatmag.com
"Chinese man sues his wife for being ugly, and the court AGREES... awarding him $120,000",3,8,dailymail.co.uk
"Everything that comes out of this administration, from its pronouncements on the overseas front to its own unemployment numbers, is a lie: it’s all lies, all the time.",3,7,original.antiwar.com
"WHOOPS: Swedish Prosecutors Drop Rape Charges Against Wikileaks Founder
 ",70,28,msnbc.msn.com
NRA blames Charleston victims as the mass shooting reaction pattern repeats,20,69,theguardian.com
TEXAS BECOMES 45TH STATE TO PASS OPEN CARRY LAW,96,291,abc13.com
Copy of Koran found in Tel Aviv gunman's backpack,4,22,jpost.com
NRA executive suggests slain Charleston pastor to blame for gun deaths.,3,27,reuters.com
" Obamites back Israel over Palestine at U.N.. Face it, if Israel wanted to start opening gas chambers to mass murder Germans, The US would back them up on it to. (not me, but our leaders)",0,7,prorevnews.blogspot.com
"Palestinians fire mortar shells into Israel containing phosphorous, banned by international law for use near civilians",12,49,jpost.com
"Young black men killed by US police at highest rate in year of 1,134 deaths",45,253,theguardian.com
"Fred Phelps, leader of Westboro Baptist Church, has died.",48,66,fox4kc.com
The scandal of fiddled global warming data,1,13,telegraph.co.uk
"Giffords, Kelly own guns while pushing gun control",0,15,news.yahoo.com
"Our ruthless banksters touch even our ""sacred heroes 'defending' our freedom"" as: Soldier in Iraq Loses Home Over $800 Debt. ""Capt. Michael Clauer's homeowners' association foreclosed on his family's $300,000 house and sold it for $3,500.""",9,9,motherjones.com
Woman held by TSA for reading Jewish paper goes public,18,20,wnd.com
Retired cop sues New York State for confiscating guns after insomnia treatment,0,2,foxnews.com
North Korea angry over release of 'Interview',2,17,cnn.com
Apple CEO Tim Cook Outed as Gay on TV By CNBC Co-Anchor Simon Hobbs,1,12,celebrity.yahoo.com
Benghazi Emails Directly Contradict White House Claims,0,5,weeklystandard.com
"Letters demand $15 million and apologies from mayor, officials for Ahmed’s clock arrest",0,49,irvingblog.dallasnews.com
'U.S. Considered Using Nukes Against Afghanistan After 9/11' says an aide to former German Chancellor Gerhard Schroder,4,27,haaretz.com
BREAKING! Kucinich Introduces 35 Articles of Impeachment Against George W. Bush!,26,8,democrats.com
BREAKING NEWS: Obama to announce complete troop withdrawal from Iraq by year's end,41,42,oregonlive.com
Golden Girl no more. Estelle Getty passes away at the age of 84,10,11,perezhilton.com
Rush Limbaugh took 4 men and 29 Viagra tablets to the Dominican Republic shortly before his recent marriage. Discuss.,69,76,thesmokinggun.com
"Computer code written by women has a higher approval rating than that written by men - but only if their gender is not identifiable, new research suggests.",0,8,bbc.co.uk
Virgin bride presents 'certificate of purity' to dad at wedding,7,21,cbc.ca
Kanye West on Beck's album of the year: 'Beck Needs to Respect Artistry,2,94,thedailybeast.com
Sandy Hook Elementary School victims. Pause a few moments after each name.,29,14,self.news
LAPD chasing perp. Perp pulls u-turn. Cops do the same and crash into third party. Third party charged with murder when cop dies.,20,36,latimes.com
Contact lost with AirAsia flight to Singapore. (Another one?),20,18,news.sky.com
"Religious people are less intelligent than atheists, according to analysis of scores of scientific studies stretching back over decades",2,3,independent.co.uk
Teen mob assaults Iraq vet and his wife,0,27,foxnews.com
CONFIRMED: Anyone who disobeys authority or even questions authority is now considered mentally ill and can be thrown in a prison-like mental institution under tax payers dollars.,0,10,infowars.com
A Fox News hit piece against 9/11 truth and Jesse Ventura inadvertently reveals a shocking truth; WTC leaseholder was “on the phone with his insurance carrier to see if they would authorize the controlled demolition of the building.”,2,8,prisonplanet.com
"Rottweiler mauls, kills toddler",3,24,msnbc.msn.com
Transgender student suspended for using bathroom at SC high school,0,66,wyff4.com
Woman Allegedly Caught on Camera Attacking Group of Muslims Who Were Praying,1,5,abcnews.go.com
Shia Labeouf arrested in Austin,0,20,variety.com
"New female Rangers did more than pass: 'They beat me,' male student says",3,17,csmonitor.com
"Jon Stewart leaving 'The Daily Show,' Comedy Central confirms",0,11,cnbc.com
Active shooter reported at Fort Lee in Virginia,2,14,washingtonpost.com
"""90% of casualties in Gaza took place after Hamas rejected ceasefire""",0,7,ynetnews.com
"Wells Fargo Is Baltimore’s Real Looter - Blacks were more likely than whites to be sold a predatory ""ghetto"" loan",186,153,reverbpress.com
US soldiers killed Afghan civilians for sport and collected fingers as trophies,53,34,theguardian.com
22 transgender women have been murdered in the U.S. this year compared with 12 last year and 13 in 2013; the number is the highest since advocacy groups began such tallies a decade ago,0,50,hosted.ap.org
'American Sniper' widow confronts Barack Obama over gun control,9,147,theguardian.com
"Snowden nominated for Nobel Peace Prize by Swedish professor. ""[H]eroic effort at great personal cost.”",2169,687,rt.com
"If you thought what's happening on Wallstreet was a few hundred people, this will surprise you. (sorry if the quality isn't great) ",13,8,imgur.com
"Indian official: 'If you can't prevent rape, you enjoy it'",22,37,chicagotribune.com
"Dallas Ends Five Decades of Water Fluoridation, Saves $1 Million a Year",36,81,nsnbc.me
"Justin Bieber has new legal woes, in his home country, face charges in connection with an alleged assault involving a limo driver in Toronto last year.",7,5,usatoday.com
"Rate Shock: In California, Obamacare to Increase Individual Health Insurance Premiums by 64-146%",6,22,forbes.com
"I live 15 minutes south of Moore, Oklahoma. Please text REDCROSS to 90999 to donate $10. The devastation is unbelievable.",11,16,self.news
20-25 Black Teens Gang-Rape Disabled Girl,0,28,abcnews.go.com
Shooting confirmed at movie theater in San Antonio.,195,95,woai.com
"IS leader ""raped"" US hostage",1,21,bbc.co.uk
Santa Barbara Area Shooting: Killer wanted to launch a “War on Women” to punish girls and women who he said had “starved [him] of sex.”,0,53,time.com
Bloomberg first to receive $1 million ‘Jewish Nobel Prize’ (mods: quit deleting this. It's news.),2,8,jta.org
Thank God for the Arizona shooting -- It stopped the mysterious bird deaths!,0,5,self.news
"""An unarmed black man was shot three times by Los Angeles police officers, once each in the back, side and arm... The autopsy, which was first obtained by the Los Angeles Times, officially classifies Ford’s death as a homicide.""",1587,821,theguardian.com
Americans attack Sikhs because they think they're Muslims,18,41,smh.com.au
"50,000 people sign petition to stop Kanye West from playing Pan Am Games closing ceremony",3569,3210,nme.com
Actor Paul Walker killed in car accident,28,28,nydailynews.com
New Mayo Clinic study: Risk-benefit analysis of conditions that neonatal circumcision protects against revealed that benefits exceed risks by at least 100 to 1,6,61,mayoclinicproceedings.org
Phillip Seymour Hoffman found dead,2580,2211,mobile.twitter.com
President Obama wins Nobel Peace Prize,50,75,reuters.com
"Salt Lake City Elects Gay Mayor, While Utah Exports Anti-Gay Hate",2,3,thedailybeast.com
Obama gives searing speech on race in eulogy for Charleston pastor,0,39,theguardian.com
"CNN anchor calls Dallas gunman ""courageous and brave.""",3,34,washingtontimes.com
"Humans are dumping extra carbon into the atmosphere at a rate unprecedented since at least the time the dinosaurs went extinct about 66 million years ago, new research suggests.",1,5,sciencenews.org
2-year-old boy killed by pit bulls at baby sitter's house,0,70,foxnews.com
"New ""Socialist"" President Francois Hollande who “dislikes the rich” and wants to revolutionize his country with high taxes, owns three homes on the French Riviera",2,7,thisislondon.co.uk
'There will be blood': NRA rips apart Australia's gun laws,3,159,mashable.com
"Comedian Joan Rivers has died, says her daughter Melissa Rivers",0,12,bigstory.ap.org
The lioness who showed remorse after realising it had killed a pregnant antelope,4,14,dailymail.co.uk
Father forced to choose between saving his drowning son or wife. He chose his wife...,4,10,dailymail.co.uk
San Antonio pastor John Hagee: Ebola is God's punishment for Obama 'dividing Jerusalem',6,30,mysanantonio.com
Oral sex can raise risk for head and neck cancer by seven times,0,36,independent.co.uk
Obama Praises Muslim Cleric Who Backed Fatwa on Killing of U.S. Soldiers; controversial cleric gets nod in Obama’s speech at the United Nations,0,24,freebeacon.com
Michael Schumacher out of coma and leaves hospital after ski accident,6,4,telegraph.co.uk
US Marshals arresting people for not paying their federal student loans,4313,5955,fox26houston.com
18 y/o girl who campaigned out of her dorm room became the youngest state lawmaker in the nation Tuesday,2970,3887,blogs.wsj.com
"As Heroin Use by Whites Soars, Parents Urge Gentler Drug War",0,12,nytimes.com
Notorious litterbug convicted of trashing Colorado national forest earns prison term,0,7,foxnews.com
White House Lit Up With Rainbow After Same-Sex Marriage Ruling | NBC4 Washington,1,5,nbcwashington.com
Koko the gorilla hit hard by her friend Robin Williams's death,1,3,newsnet5.com
The Amber Alert notification site has now been shut down due to the government shutdown.,1,4,redditlet.com
