Naslov,Score,Komentarji,VirDick Clark dies at 82 from massive heart attack ,10,4,abclocal.go.com
The FCC is now pretending to back down from its controversial net neutrality plan,2925,1183,bgr.com
1 month in jail for illegal use of.... water,46,34,rt.com
Mother of Aurora shooting victim takes about a week to grieve before deciding that she deserves cash from the theater,22,88,tmz.com
Only in conservative Republican South Carolina do we have a half/black - half/mexican Lesbian hoping to represent our state in the Miss America beauty pagaent,30,12,wyff4.com
Sisters Write Note Exposing Man's Cheating Wife at Ball Game,0,20,insider.foxnews.com
Anti-abortion group release video showing Planned Parenthood official discussing disposition of fetal remains [full video link in comments],0,11,bigstory.ap.org
"Another Day, Another Quote Fabricated By Neil deGrasse Tyson",0,9,thefederalist.com
"White House: We’ll Put Illegal Immigrants Wherever We Want, And We Won’t Tell You",0,35,ijreview.com
"Holy shit live Boston police scanner is hot right now, they almost have the marathon bombers!",2,31,self.news
"ewwww (nsfw - disturbing, no pics)",0,13,times-standard.com
25% of New Psychotic Disorders Linked to 'Skunk' Cannabis,0,39,time.com
"(DEVELOPING) Virginia Tech is reporting a gunman on campus, advising students and faculty to stay indoors.",359,262,kasa.com
"Starbucks CEO: ""As an American, I find Rudy Giuliani's vicious comments about President Obama 'not loving America' to be profoundly offensive to both the President and the Office""",3386,2534,money.cnn.com
UC Irvine Bans American Flag in Parts of Campus,14,20,thedailybeast.com
The Good Reverend Jones now has blood on his hands: Two killed in Afghan Quran burning protest,10,15,msnbc.msn.com
"California massacre victim ranted about Muslims on Facebook: “On behalf of this guy… You can stick your Million Muslim March up your asses,” alongside a photo of a shirtless victim plummeting to his death from the burning World Trade Center-'References to “Turbanheads” fill his pages'",11,91,nypost.com
ISIS operating close to US Border?,5,96,judicialwatch.org
"Dode uses a ""corporate person"" in HOV lane. Gets ticket for not two persons in car. PM's judge: ""I hope you do rule in cops favor. I hope you do overturn 125 years of settled law.”",585,276,usnews.nbcnews.com
Video shows S.F. police officers pinning down one-legged black man,5,27,blog.sfgate.com
"Hamas has dug ‘several tunnels’ into Israel, in new Iran-funded war drive",3,35,timesofisrael.com
Hillary Clinton also used iPad for e-mail,3,40,usatoday.com
Chelsea Handler mocks Kim Kardashian’s cheeky pic with her own (NSFW),0,7,news.com.au
Arabs Throw Stones at Ambulance Carrying Bodies of Murdered Boys,2,12,truthrevolt.org
"Obama fundraiser, convicted of fraud, spills beans ",0,6,news.yahoo.com
Huge idiot discovers the hard way that maybe defecting to North Korea wasn't such a good idea after all,15,9,bbc.co.uk
"Female scientists paid £5,000 less a year than their male counterparts, report finds [UK]",0,16,independent.co.uk
"NYC Man Loses Wallet, Gets a Brutally Honest Letter With Some of His Returned Belongings",2,10,abcnews.go.com
"North Bay girls who want to be Boy Scouts get chilly response - ""that's just discrimination"" claims one of the girls.",4,43,sfgate.com
Starbucks to become an LGBT 'safe place',0,36,csmonitor.com
Reform Jewish leader condemns Israeli occupation and settlements,3,0,haaretz.com
Cop attacks Women in TX. ,5,13,autos.aol.com
"The Fox News Channel announced today that it would mark Martin Luther King's ""I Have a Dream"" speech by airing an opposing view. The Fox speech, entitled ""I Have a Feverish Nightmare,"" will be delivered by network host Glenn Beck.",0,9,huffingtonpost.com
"Hillary Clinton: Let’s Be Honest, Black Men In Hoodies Are Scary",6,47,thefederalist.com
"Prisoner in van said Freddie Gray was ‘trying to injure himself,’ document says",3,10,washingtonpost.com
"More than 16 million Americans have gained insurance coverage as a result of President Barack Obama's health care law, the administration said Monday as the White House prepares to commemorate the fifth anniversary of the law's signing.",1,28,hosted.ap.org
Businesses to receive $3000 incentive for hiring illegal immigrants,7,4,foxnews.com
Police SWAT Team Dressed as Superheroes Surprise Kids at Hospital,5,13,goodnewsnetwork.org
'Modern Family' editor live-tweets drunken passenger's in-flight meltdown,63,63,news.yahoo.com
Russia gives Ukraine until 3am GMT to surrender or face an 'all out assault',2258,2694,news.sky.com
Casey Anthony declared not guilty for 1st degree murder,536,1512,news.blogs.cnn.com
Female San Bernardino suspect went to religious school,0,9,usatoday.com
"High school students called out for ""racist"" fruit basket",0,50,chron.com
"The American boy arrested for making a clock meets Sudan’s president, an accused war criminal",2,6,washingtonpost.com
Husband's pit bull rips wife's arm off,0,27,nypost.com
Confederate flag at South Carolina Capitol comes down today - Taxpayer funded Confederate shrine to be built instead,0,16,knoxnews.com
"Two gunmen shot and killed at 'Muhammad Art, Cartoon Contest' bomb squad says car is wired with incendiaries",2,5,wnd.com
Lab finds beards are as dirty as toilets,1,12,wmur.com
Americans with illegal Iraq War souvenirs go unprosecuted,2,6,phys.org
Feds giving Puerto Ricans disability benefits because they speak Spanish,1,11,foxnews.com
Students at UC Irvine Vote to Ban the American Flag,0,6,insider.foxnews.com
Striking California Longshoremen make between $83k and $147k per year,1,56,usatoday.com
MH370: Evidence of False Flag,1,7,veteranstoday.com
Tearful plea from victim's dad in deadly rampage,0,71,news.yahoo.com
Obama Nominee For Surgeon General Says Banning Guns Is Part Of Medicine,2,27,nation.foxnews.com
"Sen. Tony Smith, owner of the Stonewall's BBQ chain passes laws promoting obesity.",0,0,nydailynews.com
Ron Paul: People Are Sick &amp; Tired of Big Government - Congressman Ron Paul interview with Fox News from Iowa.,0,3,youtube.com
Iran executed my grandfather. Now the regime is trying to hide the way it has treated other Jews.,12,17,washingtonpost.com
"The Wire's David Simon: ""If you stand your ground with your fists and you're black, you're dead.""",10,12,thewrap.com
CNN: Michael Brown autopsy “expert” may be a fraud,98,73,edition.cnn.com
Republicans envy the Holocaust industry and have created one around 9/11,8,13,foxnews.com
"2 NYPD cops shot in car, both critically injured",15,58,foxnews.com
"Treasury: IRS targeted 292 Tea Party groups, just 6 progressive groups",66,98,washingtonexaminer.com
Ron Paul Is The Frontrunner In The GOP Presidential Race. Doubling Nearest Contender With  Conservatives Who Play a Big Role In The Iowa Nominating Contest On January 3 ,149,122,ohioforronpaul.com
3 teachers get sick after marijuana-laced brownies brought to suburban Detroit school,1,18,mlive.com
Fury beats Klitschko to become world champion,0,3,bbc.co.uk
Baby Eli's Rare Condition Hasn't Stopped Him From Being The Cutest Baby On Facebook,0,11,diply.com
Muslim Teen Arrested Over Homemade Clock Moving to Qatar,2,37,nbcnews.com
Bill Cosby admitted to getting drugs to give women to have sex with in 2005,0,1,mashable.com
How drunk sports fans helped spark Saturday night's post-protest violence,1,2,citypaper.com
"Hamas Used Ceasefire to Execute 25 Gazans Accused of Treachery, Blamed Israel for Deaths",2,5,algemeiner.com
Number Of Officers Killed In Line Of Duty Rises,0,15,5newsonline.com
White House: More Than 7 Million Signed Up for Obamacare,1,81,nbcnews.com
FOX News: MIT researchers devise world's toughest tongue twister,0,5,fxn.ws
So Far: More Americans Lose Health Care Than the Population of 24 States,2,10,thegatewaypundit.com
"George Zimmerman's Wife Comes Clean - Calls Him 'Selfish,' Says He Made 'Reckless Decisions'",0,11,thecontributor.com
Lone Star College shooting injures 2 in Houston - Happening now. ,0,1,abclocal.go.com
At Least 2 Shot Outside Empire State Building ,1,0,nbcnewyork.com
"In Iowa, African-Americans are 2.9 percent of the population, but they are responsible for 30.8 percent of homicide, 50.2 percent of robbery, 7.5 percent of rape, 23 percent of aggravated assault, and 17 percent of burglary",0,22,occidentaldissent.com
BBC News: One tragic final insult- No funeral for Gary Coleman,1,11,news.bbc.co.uk
Ohio Planned Parenthood Investigation Reveals Fetal Remains Disposed of in Landfills,0,67,content.govdelivery.com
"In a surprise, Obama wins Nobel Peace Prize",7,11,news.yahoo.com
Nelson Mandela dead at 95,2444,1387,3news.co.nz
Ted Kennedy Dies of Brain Cancer at Age 77 - ABC News,85,65,abcnews.go.com
Study: Murder rate drops as concealed carry permits rise,41,63,foxnews.com
Black Lives Matter activist kills self outside Ohio Statehouse,0,11,foxnews.com
NRA tweets photo of pro-gun control politicians alongside bullets,2,64,cbc.ca
Church flies Christian flag above American flag,0,65,myfoxchicago.com
We've Just Developed a Portable Cloaking Device,3,7,gizmodo.com
USA Today: Obama's niece threatened before basketball game,1,2,cnn.com
Danish scientists find link between circumcision and autism,0,16,sciencenordic.com
Transgender girl wins bid for homecoming princess at Colorado Springs high school amid concerns,3,3,gazette.com
Bitcoin inventor found,2,1,kottke.org
Harold Ramis RIP,0,0,jewcy.com
"TV Anchor Gets Called Fat, Has an Awesome Response ",0,6,mashable.com
A shooting just happened at Texas A&amp;M University. Officers and students hurt.,1,3,cnn.com
"Plz no more submissions announcing the Norway bombing, we get the idea from the first 10 or 15, kthxbai.",0,5,self.news
Zimmerman Prosecutor Angela Corey Criminally Indicted By Citizens' Grand Jury For Allegedly Falsifying Arrest Warrant And Complaint,29,27,finance.yahoo.com
Why isn't this making front headlines? You should know about Kermit Gosnell- A doctor who aborted and killed LIVE babies (regularly),10,15,washingtonpost.com
George Zimmerman found not guilty in the 2nd Degree murder charge of Trayvon Martin.,0,17,usatoday.com
"Helen Thomas says Jews, only 2% of the US Population, Dictate US Policy - You Decide",7,25,en.wikipedia.org
